,Titles,Companies,Country,Locations,Links,Ratings,Salaries,Descriptions,Urgent Hiring,time,date
78,Sr NLP & Text Mining Data Scientist,Evolent Health,India,"Pune, Maharashtra",https://in.indeed.com/rc/clk?jk=afa055080a708a86&fccid=3586973f5b1c82b8&vjs=3,3.1,None,"Job title

Sr NLP & Text Mining Data Scientist

Department

Analytics & Data Science

Report To
Deepthi Devarakonda / Simhan Ramakrishnan

No of yrs. of exp

7+ years

Work Location

Pune, MH, India

No of Positions

1

Assigned Recruiter

Talent Partner

Version Control
Version No.

Date

Remark

Updated by

1.0

5/4/2020

Initial Version

SR

It’s Time For A Change…
Your Future Evolves Here
Evolent Health has a bold mission to change the health of the nation by changing the way health care is delivered. Our pursuit of this mission is the driving force that brings us to work each day. We believe in embracing new ideas, challenging ourselves and failing forward. We respect and celebrate individual talents and team wins. We have fun while working hard and Evolenteers often make a difference in everything from scrubs to jeans.
Are we growing? Absolutely—56.7% in year-over-year revenue growth in 2016. Are we recognized? Definitely. We have been named one of “Becker’s 150 Great Places to Work in Healthcare” in 2016 and 2017, and one of the “50 Great Places to Work” in 2017 by Washingtonian, and our CEO was number one on Glassdoor’s 2015 Highest-Rated CEOs for Small and Medium Companies. If you’re looking for a place where your work can be personally and professionally rewarding, don’t just join a company with a mission. Join a mission with a company behind it.

Position summary

The Sr. NLP and Text Mining scientist will support building of AI products in Agile fashion that empower healthcare payers, providers and members to quickly process medical data to making informed decisions and overall reduce health care costs. As a research scientist/engineer part of Data Science and Artificial Intelligence team you will be working primarily on unstructured text data to build machine learning models for information retrieval applications. These applications include but are not limited to optical character recognition, understanding the contents of the medical documents using natural language processing, and integrating processes into the overall AI pipeline to mine healthcare and medical information with high recall and other relevant metrics. We ingest claims, medical charts, etc. from providers containing unstructured data which will be transformed into structured data to support automated entry into our storage layers for downstream applications. The results will be used dually for real-time operational processes with both automated and human-based decision making as well as contribute to reducing healthcare administrative costs. We work with all major cloud and big data vendors offerings including but not limited to (Azure, AWS, Google, IBM, etc.) to achieve AI goals in healthcare and support Evolent business.
Essential functions

The Sr. NLP Text Mining Scientist / Engineer will have the opportunity to lead a team, shape team culture and operating norms as a result of the fast-paced nature of a new, high-growth organization.
7+ years of Industry experience primarily related to Unstructured Text Data and NLP (PhD work and internships will be considered if they are related to unstructured text in lieu of industry experience but not more than 2 years will be accounted towards industry experience)
Develop Natural Language Medical/Healthcare documents comprehension related products to support Evolent Health business objectives, products and improve processing efficiency, reducing overall healthcare costs
Gather external data sets; build synthetic data and label data sets as per the needs for NLP/NLR/NLU
Apply expert software engineering skills to build Natural Language products to improve automation and improve user experiences leveraging unstructured data storage, Entity Recognition, POS Tagging, ontologies, taxonomies, data mining, information retrieval techniques, machine learning approach, distributed and cloud computing platforms
Own the Natural Language and Text Mining products — from platforms to systems for model training, versioning, deploying, storage and testing models with creating real time feedback loops to fully automated services
Work closely and collaborate with Data Scientists, Machine Learning engineers, IT teams and Business stakeholders spread out across various locations in US and India to achieve business goals
Provide mentoring to other Data Scientist and Machine Learning Engineers
Strong understanding of mathematical concepts including but not limited to linear algebra, Advanced calculus, partial differential equations and statistics including Bayesian approaches
Strong programming experience including understanding of concepts in data structures, algorithms, compression techniques, high performance computing, distributed computing, and various computer architecture
Good understanding and experience with traditional data science approaches like sampling techniques, feature engineering, classification and regressions, SVM, trees, model evaluations
Additional course work, projects, research participation and/or publications in Natural Language processing, reasoning and understanding, information retrieval, text mining, search, computational linguistics, ontologies, semantics
Experience with developing and deploying products in production with experience in two or more of the following languages (Python, C++, Java, Scala)
Strong Unix/Linux background and experience with at least one of the following cloud vendors like AWS, Azure, and Google for 2+ years
Hands on experience with one or more of high-performance computing and distributed computing like Spark, Dask, Hadoop, CUDA distributed GPU (2+ years)
Thorough understanding of deep learning architectures and hands on experience with one or more frameworks like tensorflow, pytorch, keras (2+ years)
Hands on experience with libraries and tools like Spacy, NLTK, Stanford core NLP, Genism, johnsnowlabs for 5+ years
Understanding business use cases and be able to translate them to team with a vision on how to implement
Identify enhancements and build best practices that can help to improve the productivity of the team.

Nice to Have
Medical concepts with codes from standard ontologies (SNOMED CT, LOINC, RxNorm, ICD, etc.)
Lucene, Solr, Elastic Search experience
Experience with Kubernetes and dockers
Experience building REST API’s for AI work and knowledge of microservices architecture
Participation in open source community projects

Academic Qualification:
Master’s degree or above in Computer Science, Computational linguistics, Mathematics, Physics or electrical engineering with research experience from a strong academic program along with thesis (No Post Graduate diplomas and undergraduate degrees)
Completion of thesis/research is required as part of graduation in computer science, artificial intelligence, Mathematics, Physics, Electrical Engineering or statistics
A PhD degree in Computer Science, Artificial Intelligence, Computational Linguistics, Machine Learning, or related technical field is preferred from a strong academic program
Publication record in top NLP conferences (NIPS, ICLR, ACL, NAACL, EMNLP, SIGIR, WWW etc) is preferred",none,19:05:46,20:12:27
79,DATA SCIENTIST,Atyeti Inc,India,"Pune, Maharashtra",https://in.indeed.com/rc/clk?jk=6f094ef428c5190e&fccid=8853c9986ff03577&vjs=3,None,None,"Job Description:

Roles and Responsibilities :
We are looking for a Natural Language Processing Engineer (Java, Python, OCR) to join our team
You will be at interfacing with the latest research within NLP & Deep Learning.
Designing experiments, testing hypotheses, and building models.
Expert programmer/engineer with Python or Java and has familiarity with OCR libraries.
Experience developing production ready solutions using agile methodology.
Strong Python developer with solid understanding of software design and architecture principles.
Experience in Python with frameworks: Flask, Numpy, pandas, nltk and scikit-learn
Worked with SQL and NoSQL databases and queues (Mongo, Kafka, Oracle DB)
Experience in building restful web-services and message oriented applications
Ideally used and built NLP and machine learning models
Experience with DevOps and/or MLOps
Hardworking Individual with good analytical and technical skills.

3.00-8.00 Years",none,19:05:46,20:12:27
80,Principal Data Scientist - Remote,Icertis,India,"Pune, Maharashtra",https://in.indeed.com/rc/clk?jk=9ac255234c0c861b&fccid=dfd806b233bf9196&vjs=3,3.8,None,"With unmatched technology and category-defining innovation, Icertis pushes the boundaries of what’s possible with contract lifecycle management (CLM). The AI-powered, analyst-validated Icertis Contract Intelligence (ICI) platform turns contracts from static documents into strategic advantage by structuring and connecting the critical contract information that defines how an organization runs. Today, the world’s most iconic brands and disruptive innovators trust Icertis to fully realize the intent of their combined 7.5 million+ contracts worth more than $1 trillion, in 40+ languages and 90+ countries.

Who we are: Icertis is the only contract intelligence platform companies trust to keep them out in front, now and in the future. Our unwavering commitment to contract intelligence is grounded in our FORTE values—Fairness, Openness, Respect, Teamwork and Execution—which guide all our interactions with employees, customers, partners and stakeholders. Because in our mission to be the contract intelligence platform of the world, we believe how we get there is as important as the destination

About the role :

The Principal Data Scientist is a detail oriented forward thinking individual who will utilize data mining, data analysis, machine learning and natural language processing to bring innovation and differentiated capabilities to the Icertis Contract Intelligence. You will be at ease with contemporary machine learning, natural language processing frameworks and quantitative approaches and will be able to critically evaluate and design, build, and support pipelines that can analyze contract document collections at scale. When no suitable approaches are available, is able to craft new and innovative machine learning and language processing solutions. Knowledge of enterprise level software architecture and components is a big plus though is not required. You will have strong verbal and written communication skills, be effective in interacting with technical and non-technical professionals, and be comfortable with team building and working in a team.

This opportunity is open for Icertis Everywhere - Full-time work from home and would not require relocation to Pune.
Responsibilities:
Partners with business stakeholders to translate business objectives into clearly defined analytical projects.
Identify opportunities for text analytics and NLP to enhance the core product platform, select the best machine learning techniques to the specific business problem and then build the models that solve the problem.
Own the end-end process, from recognizing the problem to implementing the solution.
Define the variables and their inter-relationships and extract the data from our data repositories,leveraging infrastructure including Cloud computing solutions and relational database environments.
Build predictive models that are accurate and robust and that help our customers to utilize the core platform to the maximum extent.
Skills and Qualifications:
12 to 15 yrs' of experience.
An advanced degree in predictive analytics, machine learning, artificial intelligence; or a degree in programming and significant experience with text analytics/NLP. He shall have a strong background in machine learning (unsupervised and supervised techniques). In particular, excellent understanding of machine learning techniques and algorithms, such as k-NN, Naive Bayes, SVM, Decision Forests, logistic regression, MLPs, RNNs, etc.
Experience with text mining, parsing, and classification using state-of-the-art techniques.
Experience with information retrieval, Natural Language Processing, Natural Language Understanding and Neural Language Modeling.
Ability to evaluate quality of ML models and to define the right performance metrics for models in accordance with the requirements of the core platform.
Experience in the Python data science ecosystem: Pandas, NumPy, SciPy, scikit-learn, NLTK, Gensim, etc.
Excellent verbal and written communication skills, particularly possessing the ability to share technical results and recommendations to both technical and non-technical audiences.
Ability to perform high-level work both independently and collaboratively as a project member or leader on multiple projects.
Icertis, Inc. provides Equal Employment Opportunity to all employees and applicants for employment without regard to race, color, religion, gender identity or expression, sex, sexual orientation, national origin, age, disability, genetic information, marital status, amnesty, or status as a covered veteran in accordance with applicable federal, state and local laws. Icertis, Inc. complies with applicable state and local laws governing non-discrimination in employment in every location in which the company has facilities.

Icertis is not open to third party solicitation or resumes for our posted FTE positions. Resumes received from third party agencies that are unsolicited will be considered complimentary.

If you are in need of accommodation or special assistance to navigate our website or to complete your application, please send an e-mail with your request to careers@icertis.com
By submitting your application you acknowledge that you have read Icertis’s Privacy Policy (https://www.icertis.com/privacy-statement/)",none,19:05:47,20:12:27
81,AI NLP ENGINEER,NLPBOTS,India,"Pune, Maharashtra",https://in.indeed.com/rc/clk?jk=858a640b69bcd87b&fccid=b89b46a0db7c7235&vjs=3,None,None,"Software engineer with experience in NLP and Machine Learning. You will join our team of NLP, ML experts to work on our cutting edge AI NLP Product, building deep learning, NLP modules for various features of the product. You will also work closely with the product deployment team and help build custom capabilities relevant to different business/industry functions.
To succeed in this role, you should possess outstanding skills in deep learning techniques, Sequence to sequence, LSTMs, RNNs, CNNs, machine learning methods, text representation techniques, language models etc.
What we look for: -
Advanced proficiency in the following:
1. Python
2. Natural Language Processing
3. Deep Learning
4. Machine Learning
5. Numpy, Scipy, Pandas
6. Data Science
7. MongoDB
8. NoSQL
9. SQL
10. Big Data
Experience 0-4 years (yes, freshers w/ the right aptitude and logical thinking are welcome!)
Self driven individual with a drive to learn the latest in the technology.
Exceptional team player.
Ability to clearly communicate thoughts, and collaborate on Concepts and Ideas for the product.
Good understanding and knowledge of enterprise PDLC.
Research mindset with the courage to try things and learn from them.",none,19:05:47,20:12:27
82,Data Science Application Developer,Accenture,India,"Pune, Maharashtra",https://in.indeed.com/rc/clk?jk=7184861d77974541&fccid=a4e4e2eaf26690c9&vjs=3,4,None,"Job Description
About Accenture: Accenture is a leading global professional services company, providing a broad range of services in strategy and consulting, interactive, technology and operations, with digital capabilities across all of these services. We combine unmatched experience and specialized capabilities across more than 40 industries — powered by the world’s largest network of Advanced Technology and Intelligent Operations centers. With 506,000 people serving clients in more than 120 countries, Accenture brings continuous innovation to help clients improve their performance and create lasting value across their enterprises. Visit us at www.accenture.com

Project Role :Application Developer
Project Role Description :Design, build and configure applications to meet business process and application requirements.
Management Level :9
Work Experience :6-8 years
Work location :Pune
Must Have Skills :Data Science,No Technology Specialization
Good To Have Skills :
Job Requirements :

Key Responsibilities : A : Data Scientists to support the analysis of the data and the preparation of additional big data and data analysis technologies within the CRCO area of CS in Zurich, like data modelling, wrangling, pipelines implementation or building machine learning models on the Palantir Foundry stack B : to identify the best methodologies in analytics/Machine Learning for the specific problem to solve C : Ability to develop reliable, autonomous and scalable data pipelines

Technical Experience : A :Review and IT testing of methodology to match clients via name matching B : At least 5 years of experience in Data Analytics and related tools eg Python, R, Java/Scala, Spark and SQL, ideally combined with a technology background in big-data, non-relational data bases and expertise with Bash C : Experience working in agile environments D : Familiarity with assembling and analyzing data sets from disparate sources, applying quantitative methodologies, computational frameworks and systems

Professional Attributes : A : Excellent Communication Skill

Educational Qualification : A : Minimum of 15 years full time education

Qualifications
15 years of full time education",none,19:05:47,20:12:27
83,Bioinformatic (Data Scientist) -Variant analyst,Innoplexus,India,"Pune, Maharashtra",https://in.indeed.com/rc/clk?jk=a41007039b5edb8f&fccid=60515984245a29b8&vjs=3,4.5,None,"Job Location – Pune – India
Required experience – 3-5 Years with M.Sc. or 2-4 Years with PhD of academic/Industrial
Innoplexus at its core uses AI to provide non-obvious insights to researchers by acquiring and analyzing the word’s knowledge in bioinformatics.
Our products leverage proprietary algorithms and patent pending technologies to help global Life sciences & Financial services organizations with access to relevant data, real time intelligence & intuitive insights, across the life cycle of the products.
We automate the collection, curation, aggregation, analysis & visualization, of billions of data points from thousands of data sources, using domain-specific language processing, ontologies, computer vision, machine learning, network analysis and more.
You are the right person in our team if you can:
Understand Biological data, molecular biology, computational biology, proteomics and genomics data
Should have a very fair understanding of Adverse Events and Toxicity
Application of Machine Learning or Deep Learning experience in biological data
Sound understanding of uses of NLP in biological data
Hands on experience of Applied Statistics in Life Science data
Understand R, Python, Weka, Spark and latest technologies in data sciences
Knowledge of Proteins, Drugs, Clinical trials and Literatures databases is required
We need you to have:
BTech or MSc or M Pharma or PhD in Biotechnology/Bioinformatics/Cheminformatics/Pharmacoinformatics/Pharmacy
To excel in this job, you must bring 3-5 Years with M.Sc. or 2-4 Years with PhD of academic/Industrial with experience in:
Good presentation and communication skills
Strong leadership qualities. Ready to own the work
Experience in CRO or Pharma is desirable
Working experience on Adverse Events and Toxicity module
Good analytical and reasoning skills
Track record of managing small team is an advantage
Understanding of Biological data and databases is a plus
Knowledge of databases like Proteins, Drugs and Literatures databases is desirable
Research paper publications in good journals
Innoplexus believes in the power of collaboration and teamwork. You will work and grow alongside creative thinkers to turn great ideas into reality. We will help you develop your skills with training courses and knowledge sharing.",none,19:05:47,20:12:27
84,Machine Learning Engineer,Climate Connect,India,"Pune, Maharashtra",https://in.indeed.com/rc/clk?jk=faca6e206457f657&fccid=73a370368bf25684&vjs=3,4,None,"About us:
Climate Connect Ltd. applies Artificial Intelligence (AI) forecasting techniques such as Neural Networks, Support Vector Machines and Gradient Boosting, to a range of opportunities within the evolving energy ecosystem. Climate Connect was founded in 2010 by Cambridge University alumni, after rapid growth the young company now has a team of 40+ people spread across 3 main locations: Delhi (India), Pune (India), Amsterdam (NL). We also run a carbon market intelligence platform, CaliforniaCarbon.info, and so have strong business interests and are firmly embedded in the energy networks on the US West Coast.
We build forecasting and optimisation software for renewable energy and storage technologies to enable asset owners to see greater returns from their investments. This may be achieved through smart analytics to improve operational efficiency; dynamic forecast to reduce the costs of variable production; or when aligned with our proprietary price forecasting, increase revenue by selling directly though to markets. As such, we recruit across a range of different skill sets: engineers, software developers, pure mathematicians, meteorologists, economists, and those with a commercial understanding of energy markets.
In sum, we build software that removes middle-men within the current energy paradigm, and returns value to the owners of generative and distributive capacity. Across almost every sector: transport, housing, even food, AI is having a revolutionary and localising effect, Climate Connect is at the epicentre of this transformation in energy.
Otherwise, it is important for candidates to understand Climate Connect’s working environment. The vast majority of the company’s team is under 30, we have 6 different nationalities, and we have no time for ‘corporate culture’. Our philosophy to working hours and locations is entirely output focused, we allow our team to function to best suit their productivity be it working from home, at night, or on an impromptu hiking trip to the Himalayas! Team members often see business meetings spread over India, or indeed America, as opportunities to mix work and travel to give the richest working experience possible.
The Role:
Climate Connect is looking for an Energy Machine Learning Engineer to assist in developing forecasting models for energy generation, load, and market prices. The Ideal candidate will have experience in developing mathematical algorithms and a broad knowledge of statistics, machine learning, optimization, and financial mathematics. Strong programming skills round out the ideal candidate's profile. The Machine Learning Engineer will be an integral part of our Climate Connect team, therefore responsible for:
Developing and testing electricity and carbon allowance price forecasting algorithms using large datasets such as load, weather, historical, grid, forward markets etc.
Developing and testing algorithms using our price forecasts, and customers' energy portfolio.
Leading software engineering team in deploying the developed models tailored to specific customer needs.
Participating in the software development process, testing, and debugging required to support the deployed models.
Desired Skills:
Advanced knowledge of Python.
Experience in working with libraries like Numpy, Pandas, sk-learn, tensorflow, pytorch, keras, xgboost, autograd, plotly, Jupyter etc.
Knowledge of ML algorithms like clustering, SVMs, NNs, XGBoost etc.
Experience working with large databases to access, manipulate and process data. Knowledge of MySQL, MongoDB, ElasticSearch or other nosql database implementations.
Comfortable with the concept of APIs and JSON-REST. Able to access and work with various data APIs.
Comfortable with a wide set of machine learning approaches and designing the features and data processing to actually make them work.
Demonstrate ability to transform theoretical knowledge to practical, real-world situations.
Be results-oriented, able to meet tight deadlines and produce clear and concise feedback/reports to senior management.
Proven ability to work on multiple complex and competing business objectives in a highly fluid and dynamic environment.
Excellent English communication skills; the ability to convey your message to team members and other stakeholders
Must be willing to work in a very flexible start-up environment.
Good to have working knowledge in PHP and other frontend technologies like Angular.
Good to have knowledge of backend technologies Message Queues, IPC.
Good to have knowledge of working with cloud providers like AWS and DigitalOcean.
Candidates who do not possess above skills in full time roles, but did internships and voluntary work to learn the skills, will be considered.
Qualification:
BS or MS degree in Computer Science, Engineering, Mathematics, Physics, Economics or other quantitative discipline.
Experience:
0 to 3 years.
Location:
Pune, India
Remuneration:
Competitive
Application:
Please send your CV (no longer than two pages) and cover letter to hr@climate-connect.com.",none,19:05:47,20:12:27
